PK_Md,reviewId,product,reviewDate,reviewerName,review,rating,recommendation,url
2d4f9eacb3bb819f8f3bdfc78fdc9426,4be936a5903c37603bfea94d,Apple iPhone 13 5G 128GB (Unlocked) Midnight MMM63LLA,2023-05-17,Aleily,Pretty good sturdy phone. Accidentally dropped it while getting off my car and nothing happened. Last iphone I has (Iphone 12 mini) literally bent in half with 1 fall,5,True,https://www.bestbuy.com/site/reviews/apple-iphone-13-5g-128gb-unlocked-midnight/6417788?variant=A&skuId=6417788&sort=MOST_RECENT&page=14
2d4f9eacb3bb819f8f3bdfc78fdc9426,c0d839f887bf5de361cf3027,Apple iPhone 13 5G 128GB (Unlocked) Midnight MMM63LLA,2023-05-16,DaddyJohn93,I love this phone great camera and phone space and its snappy! Definitely would recommend or maybe the next in line iPhone 14,5,True,https://www.bestbuy.com/site/reviews/apple-iphone-13-5g-128gb-unlocked-midnight/6417788?variant=A&skuId=6417788&sort=MOST_RECENT&page=14
2d4f9eacb3bb819f8f3bdfc78fdc9426,b059357b9adea485a2808241,Apple iPhone 13 5G 128GB (Unlocked) Midnight MMM63LLA,2023-05-15,techdoug,This is the best deal for a unlocked iPhone with a SIM card tray I had a iPhone 14 and I hatted the esim only option this is so easy to swap out for different networks not like the 14 this feels the exact same as a 14 just get this one instead !!!,5,True,https://www.bestbuy.com/site/reviews/apple-iphone-13-5g-128gb-unlocked-midnight/6417788?variant=A&skuId=6417788&sort=MOST_RECENT&page=14
2d4f9eacb3bb819f8f3bdfc78fdc9426,ffb43368af02ea2c67a8edde,Apple iPhone 13 5G 128GB (Unlocked) Midnight MMM63LLA,2023-05-14,LourdesM,Beautiful iphone!! This was for my sons girlfriend  and she really love it!!!,5,True,https://www.bestbuy.com/site/reviews/apple-iphone-13-5g-128gb-unlocked-midnight/6417788?variant=A&skuId=6417788&sort=MOST_RECENT&page=14
2d4f9eacb3bb819f8f3bdfc78fdc9426,65613d64884bb577fe42af20,Apple iPhone 13 5G 128GB (Unlocked) Midnight MMM63LLA,2023-05-14,Iphone13,Good but the camera overall is not good enough to give 100 percent rating,3,True,https://www.bestbuy.com/site/reviews/apple-iphone-13-5g-128gb-unlocked-midnight/6417788?variant=A&skuId=6417788&sort=MOST_RECENT&page=14
2d4f9eacb3bb819f8f3bdfc78fdc9426,623b3607bbff6d6d8e5bf6cc,Apple iPhone 13 5G 128GB (Unlocked) Midnight MMM63LLA,2023-05-13,Yolamisma,My favorite model perfect size and no hardware issues.,5,True,https://www.bestbuy.com/site/reviews/apple-iphone-13-5g-128gb-unlocked-midnight/6417788?variant=A&skuId=6417788&sort=MOST_RECENT&page=14
2d4f9eacb3bb819f8f3bdfc78fdc9426,9b2933c0876a5456713d9d43,Apple iPhone 13 5G 128GB (Unlocked) Midnight MMM63LLA,2023-05-12,RussellB,I love it super happy with it not too big I had a max pro before constantly dropping it because it would fall out of my hands. This is,5,True,https://www.bestbuy.com/site/reviews/apple-iphone-13-5g-128gb-unlocked-midnight/6417788?variant=A&skuId=6417788&sort=MOST_RECENT&page=14
2d4f9eacb3bb819f8f3bdfc78fdc9426,19483472a2a3eecad3b9fca0,Apple iPhone 13 5G 128GB (Unlocked) Midnight MMM63LLA,2023-05-12,PemaT,This phone is very nice I bought for my mom For mother days,4,True,https://www.bestbuy.com/site/reviews/apple-iphone-13-5g-128gb-unlocked-midnight/6417788?variant=A&skuId=6417788&sort=MOST_RECENT&page=14
2d4f9eacb3bb819f8f3bdfc78fdc9426,495534aca2d7a178e8e1b344,Apple iPhone 13 5G 128GB (Unlocked) Midnight MMM63LLA,2023-05-10,Nera,The phone is ok but the only thing I dislike is the battery dying fast in the phone goes in out we you having a conversation,4,True,https://www.bestbuy.com/site/reviews/apple-iphone-13-5g-128gb-unlocked-midnight/6417788?variant=A&skuId=6417788&sort=MOST_RECENT&page=14
2d4f9eacb3bb819f8f3bdfc78fdc9426,6bf733ecb7f9b10b59ac4789,Apple iPhone 13 5G 128GB (Unlocked) Midnight MMM63LLA,2023-05-08,Sterling,Absolutely love the 13 i have! I highly recommend this phone!,5,True,https://www.bestbuy.com/site/reviews/apple-iphone-13-5g-128gb-unlocked-midnight/6417788?variant=A&skuId=6417788&sort=MOST_RECENT&page=14
2d4f9eacb3bb819f8f3bdfc78fdc9426,7baa37e18481d642a9bcfc45,Apple iPhone 13 5G 128GB (Unlocked) Midnight MMM63LLA,2023-05-05,Quan,Walk in found exactly what i was looking in seconds and it works perfectly,4,True,https://www.bestbuy.com/site/reviews/apple-iphone-13-5g-128gb-unlocked-midnight/6417788?variant=A&skuId=6417788&sort=MOST_RECENT&page=14
2d4f9eacb3bb819f8f3bdfc78fdc9426,2cea34bda9ac5336a8050615,Apple iPhone 13 5G 128GB (Unlocked) Midnight MMM63LLA,2023-05-05,iPhone13,Great phone. Easy to operate. My wife loves it. Would buy again.,5,True,https://www.bestbuy.com/site/reviews/apple-iphone-13-5g-128gb-unlocked-midnight/6417788?variant=A&skuId=6417788&sort=MOST_RECENT&page=14
2d4f9eacb3bb819f8f3bdfc78fdc9426,05f3300f8ae52ee803c8de76,Apple iPhone 13 5G 128GB (Unlocked) Midnight MMM63LLA,2023-05-03,Krod2810,Big improvement from my iPhone XR. The only issue I have which is personal preference is that the back is glass so its a finger print magnet.,5,True,https://www.bestbuy.com/site/reviews/apple-iphone-13-5g-128gb-unlocked-midnight/6417788?variant=A&skuId=6417788&sort=MOST_RECENT&page=14
2d4f9eacb3bb819f8f3bdfc78fdc9426,176737f0a7b1eb72b0a46665,Apple iPhone 13 5G 128GB (Unlocked) Midnight MMM63LLA,2023-05-03,Isaac,Love this phone so much the color is so nice and the phone is so fast.,5,True,https://www.bestbuy.com/site/reviews/apple-iphone-13-5g-128gb-unlocked-midnight/6417788?variant=A&skuId=6417788&sort=MOST_RECENT&page=14
2d4f9eacb3bb819f8f3bdfc78fdc9426,66e6386093b740ae4d8cbec2,Apple iPhone 13 5G 128GB (Unlocked) Midnight MMM63LLA,2023-04-30,dmck08,This is my first iPhone. There is no competition to Apple. Everything runs smoother than Android. Safari by far surpasses Google Chrome. Amazing value in such a small device.,5,True,https://www.bestbuy.com/site/reviews/apple-iphone-13-5g-128gb-unlocked-midnight/6417788?variant=A&skuId=6417788&sort=MOST_RECENT&page=15
2d4f9eacb3bb819f8f3bdfc78fdc9426,90a931b2b8fafb2270679bfe,Apple iPhone 13 5G 128GB (Unlocked) Midnight MMM63LLA,2023-04-29,RubyM,Came in new as expected although there was a little delay in order fulfillment! Glad I got what I ordered,5,True,https://www.bestbuy.com/site/reviews/apple-iphone-13-5g-128gb-unlocked-midnight/6417788?variant=A&skuId=6417788&sort=MOST_RECENT&page=15
2d4f9eacb3bb819f8f3bdfc78fdc9426,19a03bfa802fba8a487bf9c4,Apple iPhone 13 5G 128GB (Unlocked) Midnight MMM63LLA,2023-04-27,Pinoyako1215,Upgrade my son iphone xsmax to 13 better camera 120 hrz,5,True,https://www.bestbuy.com/site/reviews/apple-iphone-13-5g-128gb-unlocked-midnight/6417788?variant=A&skuId=6417788&sort=MOST_RECENT&page=15
2d4f9eacb3bb819f8f3bdfc78fdc9426,b6c734b4ac9c361db8f00057,Apple iPhone 13 5G 128GB (Unlocked) Midnight MMM63LLA,2023-04-21,Enkore1911,Purchased it for my 9 year old. Couple of drops still pushing. Great phone.,5,True,https://www.bestbuy.com/site/reviews/apple-iphone-13-5g-128gb-unlocked-midnight/6417788?variant=A&skuId=6417788&sort=MOST_RECENT&page=15
2d4f9eacb3bb819f8f3bdfc78fdc9426,9de23b15bd6ff7f0540f8162,Apple iPhone 13 5G 128GB (Unlocked) Midnight MMM63LLA,2023-04-20,Helloguy23,Looking for a nice entry level iphone this is it. I recommended,5,True,https://www.bestbuy.com/site/reviews/apple-iphone-13-5g-128gb-unlocked-midnight/6417788?variant=A&skuId=6417788&sort=MOST_RECENT&page=15
2d4f9eacb3bb819f8f3bdfc78fdc9426,60033a79a0bcccb1fae416b1,Apple iPhone 13 5G 128GB (Unlocked) Midnight MMM63LLA,2023-04-20,Mehgas,Purely anecdotal poll fax bed Diaz led care pull ex creed oh face oh TV vocal,5,True,https://www.bestbuy.com/site/reviews/apple-iphone-13-5g-128gb-unlocked-midnight/6417788?variant=A&skuId=6417788&sort=MOST_RECENT&page=15
2d4f9eacb3bb819f8f3bdfc78fdc9426,c4e3349b9cd1e3735b136412,Apple iPhone 13 5G 128GB (Unlocked) Midnight MMM63LLA,2023-04-19,Layin,Great phone an upgrade from my iphone xr for sure. 0.5x camera gives good look to photos.,5,True,https://www.bestbuy.com/site/reviews/apple-iphone-13-5g-128gb-unlocked-midnight/6417788?variant=A&skuId=6417788&sort=MOST_RECENT&page=15
2d4f9eacb3bb819f8f3bdfc78fdc9426,048835a591a62d234a5085ea,Apple iPhone 13 5G 128GB (Unlocked) Midnight MMM63LLA,2023-04-13,Yessir,I love it always shop there and go lloks for my electronics,5,False,https://www.bestbuy.com/site/reviews/apple-iphone-13-5g-128gb-unlocked-midnight/6417788?variant=A&skuId=6417788&sort=MOST_RECENT&page=15
2d4f9eacb3bb819f8f3bdfc78fdc9426,e3ee3331920b235e3797c0a4,Apple iPhone 13 5G 128GB (Unlocked) Midnight MMM63LLA,2023-04-07,Wally,Worked perfectly with my sim card. Brand new in box. Great product.,5,True,https://www.bestbuy.com/site/reviews/apple-iphone-13-5g-128gb-unlocked-midnight/6417788?variant=A&skuId=6417788&sort=MOST_RECENT&page=15
04e612dee0c01557c6865c81e4cc3c3e,8bce383ab98fc08a4e0f6d5d,Apple iPhone 14 128GB Midnight (Verizon) MPUA3LLA,2023-08-18,Patsy,I love my Apple Iphone 14.  It has many useful features takes great pictures and is also very attractive.,5,True,https://www.bestbuy.com/site/reviews/apple-iphone-14-128gb-midnight-verizon/6505109?variant=A&skuId=6505109&sort=MOST_RECENT&page=1
04e612dee0c01557c6865c81e4cc3c3e,236a3ddd81728b82a4edb32c,Apple iPhone 14 128GB Midnight (Verizon) MPUA3LLA,2023-08-18,LisaS,I love my new iPhone! The best part is that is not that different from my old phone but the battery is great. The camera is also wonderful.,5,True,https://www.bestbuy.com/site/reviews/apple-iphone-14-128gb-midnight-verizon/6505109?variant=A&skuId=6505109&sort=MOST_RECENT&page=1
04e612dee0c01557c6865c81e4cc3c3e,43de3d77830002a59ae68c8c,Apple iPhone 14 128GB Midnight (Verizon) MPUA3LLA,2023-08-16,Kelvin,I love iphones they are the beat i love them so much,5,True,https://www.bestbuy.com/site/reviews/apple-iphone-14-128gb-midnight-verizon/6505109?variant=A&skuId=6505109&sort=MOST_RECENT&page=1
04e612dee0c01557c6865c81e4cc3c3e,d19d3fc784c16f3e946c4052,Apple iPhone 14 128GB Midnight (Verizon) MPUA3LLA,2023-08-12,StephenM,Good size.  Works great.  Fast and love the camera.,5,True,https://www.bestbuy.com/site/reviews/apple-iphone-14-128gb-midnight-verizon/6505109?variant=A&skuId=6505109&sort=MOST_RECENT&page=1
04e612dee0c01557c6865c81e4cc3c3e,0a6e3ee1bc24d1fe5fb30d34,Apple iPhone 14 128GB Midnight (Verizon) MPUA3LLA,2023-08-11,MinenB,Very Happy with my IPHONE 14  very knowledgeable customer service  very helpful staff,5,True,https://www.bestbuy.com/site/reviews/apple-iphone-14-128gb-midnight-verizon/6505109?variant=A&skuId=6505109&sort=MOST_RECENT&page=1
04e612dee0c01557c6865c81e4cc3c3e,ce813dc68f2bfe768235b6ec,Apple iPhone 14 128GB Midnight (Verizon) MPUA3LLA,2023-08-11,CasadraM,It was amazing service he help me with everything and it works very well,5,True,https://www.bestbuy.com/site/reviews/apple-iphone-14-128gb-midnight-verizon/6505109?variant=A&skuId=6505109&sort=MOST_RECENT&page=1
04e612dee0c01557c6865c81e4cc3c3e,f3e43dfaa0fa63d1ee871e61,Apple iPhone 14 128GB Midnight (Verizon) MPUA3LLA,2023-08-08,Rivers13,Im getting used to all the swiping but I do like the clarity of the screen.  Im disappointed that I still have to charge it on a daily basis.  I was hoping the battery would last longer.  I havent tried taking a picture yet.,4,True,https://www.bestbuy.com/site/reviews/apple-iphone-14-128gb-midnight-verizon/6505109?variant=A&skuId=6505109&sort=MOST_RECENT&page=1
04e612dee0c01557c6865c81e4cc3c3e,fe3f3f658c105b7d303eed71,Apple iPhone 14 128GB Midnight (Verizon) MPUA3LLA,2023-07-28,V2laptop,Love my new  by phone! Great size takes good pics holds battery charge.,5,True,https://www.bestbuy.com/site/reviews/apple-iphone-14-128gb-midnight-verizon/6505109?variant=A&skuId=6505109&sort=MOST_RECENT&page=1
04e612dee0c01557c6865c81e4cc3c3e,ef6f37e793a0a9b96610d2f3,Apple iPhone 14 128GB Midnight (Verizon) MPUA3LLA,2023-07-24,Stiltzy,Its an Iphone. If youre in the iOS ecosystem and not a photographer stick with the standard and save some $$$,5,True,https://www.bestbuy.com/site/reviews/apple-iphone-14-128gb-midnight-verizon/6505109?variant=A&skuId=6505109&sort=MOST_RECENT&page=1
04e612dee0c01557c6865c81e4cc3c3e,969f36e6bc2872055022c1cc,Apple iPhone 14 128GB Midnight (Verizon) MPUA3LLA,2023-07-15,TiondaE,Great item love the color and the quality. Would recommend to anyone.,5,True,https://www.bestbuy.com/site/reviews/apple-iphone-14-128gb-midnight-verizon/6505109?variant=A&skuId=6505109&sort=MOST_RECENT&page=1
04e612dee0c01557c6865c81e4cc3c3e,91653c28a58d4311961d8294,Apple iPhone 14 128GB Midnight (Verizon) MPUA3LLA,2023-07-14,JacksonB,I have loved this phone from the day I got it would recommend it for anyone,5,True,https://www.bestbuy.com/site/reviews/apple-iphone-14-128gb-midnight-verizon/6505109?variant=A&skuId=6505109&sort=MOST_RECENT&page=1
04e612dee0c01557c6865c81e4cc3c3e,a6af3c84972653a5c53e29e3,Apple iPhone 14 128GB Midnight (Verizon) MPUA3LLA,2023-07-14,KhrishellnaeF,I love how light weight it is and how it came in my favorite color Yellow. Also I drop the phone like 5 times on cement by accident without a case on it didnt even break like my iPhone 11 did. And I hardly ever charger my phone and if I have a 100 percent battery one day it can last me up to three days or more if I dont use any of my apps.,5,True,https://www.bestbuy.com/site/reviews/apple-iphone-14-128gb-midnight-verizon/6505109?variant=A&skuId=6505109&sort=MOST_RECENT&page=1
04e612dee0c01557c6865c81e4cc3c3e,d2873943b887059f17e3906b,Apple iPhone 14 128GB Midnight (Verizon) MPUA3LLA,2023-07-14,MarvinS,I went from an iPhone SE with 4G to this one with 5G.  Great investment!,5,True,https://www.bestbuy.com/site/reviews/apple-iphone-14-128gb-midnight-verizon/6505109?variant=A&skuId=6505109&sort=MOST_RECENT&page=1
04e612dee0c01557c6865c81e4cc3c3e,d3a838529abca647d38166ec,Apple iPhone 14 128GB Midnight (Verizon) MPUA3LLA,2023-07-14,user964459,I picked up my device after ordering online and the experience was great! Very kind and helpful associates. The phone itself was brand new and is definitely great as well!,5,True,https://www.bestbuy.com/site/reviews/apple-iphone-14-128gb-midnight-verizon/6505109?variant=A&skuId=6505109&sort=MOST_RECENT&page=1
04e612dee0c01557c6865c81e4cc3c3e,0d963baa840b4785db8c5ad9,Apple iPhone 14 128GB Midnight (Verizon) MPUA3LLA,2023-07-13,AmandaL,Works as expected! Had the XR and then switched to Samsung S22 just to see if we liked it better. Had it 6 months and switched right back. Just so user friendly and smooth. Also i feel like my battery lasts so much longer than the s22. Even when both phones were in battery saving mode with Bluetooth and Wi-Fi off.,5,True,https://www.bestbuy.com/site/reviews/apple-iphone-14-128gb-midnight-verizon/6505109?variant=A&skuId=6505109&sort=MOST_RECENT&page=1
04e612dee0c01557c6865c81e4cc3c3e,43e23a4ca5cfcb9378f84f33,Apple iPhone 14 128GB Midnight (Verizon) MPUA3LLA,2023-07-13,JamesS,Easy transfer from my old Galaxy S7 with Move to iOS app. No assistance needed. My first Apple device and fairly intuitive interface - even for a retiree!,5,True,https://www.bestbuy.com/site/reviews/apple-iphone-14-128gb-midnight-verizon/6505109?variant=A&skuId=6505109&sort=MOST_RECENT&page=1
04e612dee0c01557c6865c81e4cc3c3e,c9f13336bbec2fced926051d,Apple iPhone 14 128GB Midnight (Verizon) MPUA3LLA,2023-07-10,Bcv1,Love this phone. Great display very fast and long battery life between charges.,5,True,https://www.bestbuy.com/site/reviews/apple-iphone-14-128gb-midnight-verizon/6505109?variant=A&skuId=6505109&sort=MOST_RECENT&page=1
04e612dee0c01557c6865c81e4cc3c3e,7ba238a18772f3f5e2f61d68,Apple iPhone 14 128GB Midnight (Verizon) MPUA3LLA,2023-07-07,Myreview,Very happy so far with my new iPhone 14 128 GB.  Pictures are supposed to be better but I cant really tell much diff from my old iPhone 8.  But screen is bigger.,5,True,https://www.bestbuy.com/site/reviews/apple-iphone-14-128gb-midnight-verizon/6505109?variant=A&skuId=6505109&sort=MOST_RECENT&page=1
04e612dee0c01557c6865c81e4cc3c3e,61093f18b7b5c8a15c5e8772,Apple iPhone 14 128GB Midnight (Verizon) MPUA3LLA,2023-07-01,Embuff,I bought it for my son. It should last him through high school.,5,True,https://www.bestbuy.com/site/reviews/apple-iphone-14-128gb-midnight-verizon/6505109?variant=A&skuId=6505109&sort=MOST_RECENT&page=1
04e612dee0c01557c6865c81e4cc3c3e,b48a39b0a29cc6661f22c224,Apple iPhone 14 128GB Midnight (Verizon) MPUA3LLA,2023-07-01,Disappointed,I bought this for my granddaughter as her 1st phone and she loves it.  Easy for her to set up by herself and shes only 11 years old.,5,True,https://www.bestbuy.com/site/reviews/apple-iphone-14-128gb-midnight-verizon/6505109?variant=A&skuId=6505109&sort=MOST_RECENT&page=1
04e612dee0c01557c6865c81e4cc3c3e,83fe34a99dda8da773d19054,Apple iPhone 14 128GB Midnight (Verizon) MPUA3LLA,2023-05-05,BarbH,Love my new phone and the process was so fast.  Alyson was so helpful!,5,True,https://www.bestbuy.com/site/reviews/apple-iphone-14-128gb-midnight-verizon/6505109?variant=A&skuId=6505109&sort=MOST_RECENT&page=2
04e612dee0c01557c6865c81e4cc3c3e,28d33e009e7d1d12c0553419,Apple iPhone 14 128GB Midnight (Verizon) MPUA3LLA,2023-06-29,AGThird,Bought this for my sons birthday. His iPhone 8 gave out about a month prior so I thought a little upgrade would be nice since he was going to New York in a few weeks. I opted for this phone because of the long battery life and camera. I was expecting a ton of pics but he only sent about 5 which is fine. I guess he was living in the moment but he hasnt had any problems with it. Its quite an upgrade from the 8 for sure although its not as slim to fit in front pockets for a teenager.,5,True,https://www.bestbuy.com/site/reviews/apple-iphone-14-128gb-midnight-verizon/6505109?variant=A&skuId=6505109&sort=MOST_RECENT&page=2
04e612dee0c01557c6865c81e4cc3c3e,5d8239f79f3f86004ded537a,Apple iPhone 14 128GB Midnight (Verizon) MPUA3LLA,2023-06-28,Vicky,Great phone!  We upgraded from the 12 to the 14 and love this phone.  Only issue is it is heavier than previous model and the trade in process was not easy at BestBuy.  I had to go to Verizon to get it done.,5,True,https://www.bestbuy.com/site/reviews/apple-iphone-14-128gb-midnight-verizon/6505109?variant=A&skuId=6505109&sort=MOST_RECENT&page=2
04e612dee0c01557c6865c81e4cc3c3e,389a3d069caa70aa1c8dfcc7,Apple iPhone 14 128GB Midnight (Verizon) MPUA3LLA,2023-06-23,Ryan,Awesome phone and is the perfect size. I didnt need the Pro or need a phone for anything extensive like photography or heavy application use. Its aesthetically pleasing and Apple seems to have improved the antenna reception and overall performance. Unlike previous models Im not experiencing dropped calls and device performance and network connectivity has greatly improved since my iPhone 12. Im very pleased with this purchase.,5,True,https://www.bestbuy.com/site/reviews/apple-iphone-14-128gb-midnight-verizon/6505109?variant=A&skuId=6505109&sort=MOST_RECENT&page=2
04e612dee0c01557c6865c81e4cc3c3e,a0bf3d92aad4a81c40307f4f,Apple iPhone 14 128GB Midnight (Verizon) MPUA3LLA,2023-06-21,Mwillia48,Great phone for my middle schooler. Customer service was fantastic.,5,True,https://www.bestbuy.com/site/reviews/apple-iphone-14-128gb-midnight-verizon/6505109?variant=A&skuId=6505109&sort=MOST_RECENT&page=2
04e612dee0c01557c6865c81e4cc3c3e,e94e35eaabaf3b9c15f0b0f5,Apple iPhone 14 128GB Midnight (Verizon) MPUA3LLA,2023-06-16,user970128,I Am very Pleased with this new Iphone!! It is a great upgrade from the 8 I used to have.,5,True,https://www.bestbuy.com/site/reviews/apple-iphone-14-128gb-midnight-verizon/6505109?variant=A&skuId=6505109&sort=MOST_RECENT&page=2
04e612dee0c01557c6865c81e4cc3c3e,1b6a3b4984c46c4bcda92a5d,Apple iPhone 14 128GB Midnight (Verizon) MPUA3LLA,2023-06-09,Dphe,Great phone for what i needed it for. My kids enjoy their iphones.,5,True,https://www.bestbuy.com/site/reviews/apple-iphone-14-128gb-midnight-verizon/6505109?variant=A&skuId=6505109&sort=MOST_RECENT&page=2
04e612dee0c01557c6865c81e4cc3c3e,fcea3a94a877dc91a804b933,Apple iPhone 14 128GB Midnight (Verizon) MPUA3LLA,2023-06-09,Vera,I like it simple is that best color yet and screen is awesome,5,True,https://www.bestbuy.com/site/reviews/apple-iphone-14-128gb-midnight-verizon/6505109?variant=A&skuId=6505109&sort=MOST_RECENT&page=2
04e612dee0c01557c6865c81e4cc3c3e,a8e13cf887acd01760cc5831,Apple iPhone 14 128GB Midnight (Verizon) MPUA3LLA,2023-06-06,Maria,This was for my son he and I like it so much that I am about to switch from Samsung to this phone,5,True,https://www.bestbuy.com/site/reviews/apple-iphone-14-128gb-midnight-verizon/6505109?variant=A&skuId=6505109&sort=MOST_RECENT&page=2
04e612dee0c01557c6865c81e4cc3c3e,d4e23a24b9b4c8dac538e97c,Apple iPhone 14 128GB Midnight (Verizon) MPUA3LLA,2023-06-06,TopHat,What can I say its an iPhone thats known for its ease of use and has lots of pluses. This is my first iPhone so still learning my way around. So far everything working as it should. Fingerprint and facial recognition work easily. Apps are plentiful. Suggestion: Get a case and screen protector as an unprotected phone can be damaged easily if it falls on a hard surface and these help protect your investment and resale value.,5,True,https://www.bestbuy.com/site/reviews/apple-iphone-14-128gb-midnight-verizon/6505109?variant=A&skuId=6505109&sort=MOST_RECENT&page=2
04e612dee0c01557c6865c81e4cc3c3e,0659315d873477e2ea67c2eb,Apple iPhone 14 128GB Midnight (Verizon) MPUA3LLA,2023-06-03,Mouse,New Phone for teenage daughter.  Replacing older model with more memory.  Phone and functionality is great.,5,True,https://www.bestbuy.com/site/reviews/apple-iphone-14-128gb-midnight-verizon/6505109?variant=A&skuId=6505109&sort=MOST_RECENT&page=2
04e612dee0c01557c6865c81e4cc3c3e,b8c13e9fbed2806baf00c984,Apple iPhone 14 128GB Midnight (Verizon) MPUA3LLA,2023-06-03,AnyaQ,Camera is the best. My pictures come out amazing !!,5,True,https://www.bestbuy.com/site/reviews/apple-iphone-14-128gb-midnight-verizon/6505109?variant=A&skuId=6505109&sort=MOST_RECENT&page=2
04e612dee0c01557c6865c81e4cc3c3e,568c3a1183c639203268af88,Apple iPhone 14 128GB Midnight (Verizon) MPUA3LLA,2023-06-02,DamontreaM,my iphone 14 is so awesome i honestly enjoy every feature i love the point five feature and i love the fact its not that huge,5,True,https://www.bestbuy.com/site/reviews/apple-iphone-14-128gb-midnight-verizon/6505109?variant=A&skuId=6505109&sort=MOST_RECENT&page=2
04e612dee0c01557c6865c81e4cc3c3e,54f93f76b9aae02fab4dc6e7,Apple iPhone 14 128GB Midnight (Verizon) MPUA3LLA,2023-05-27,user168069,Love this phone and so happy to have iPhone with voice accessibility since I am visually impaired.,5,True,https://www.bestbuy.com/site/reviews/apple-iphone-14-128gb-midnight-verizon/6505109?variant=A&skuId=6505109&sort=MOST_RECENT&page=2
04e612dee0c01557c6865c81e4cc3c3e,f8fe341a9254c99d3f1dea90,Apple iPhone 14 128GB Midnight (Verizon) MPUA3LLA,2023-05-20,JadenM,Really good iPhone love it and it works good and its very fast,5,True,https://www.bestbuy.com/site/reviews/apple-iphone-14-128gb-midnight-verizon/6505109?variant=A&skuId=6505109&sort=MOST_RECENT&page=2
04e612dee0c01557c6865c81e4cc3c3e,3d873c7aa6840143b28297ee,Apple iPhone 14 128GB Midnight (Verizon) MPUA3LLA,2023-05-19,Iphonerae77,Good product. Nice sound. Clear display. Excellent store space,5,True,https://www.bestbuy.com/site/reviews/apple-iphone-14-128gb-midnight-verizon/6505109?variant=A&skuId=6505109&sort=MOST_RECENT&page=2
04e612dee0c01557c6865c81e4cc3c3e,e39e36419ca811285d62f94a,Apple iPhone 14 128GB Midnight (Verizon) MPUA3LLA,2023-05-06,DaveJ,The sales person was very helpful knowledgeable and enjoyable to deal with.,5,True,https://www.bestbuy.com/site/reviews/apple-iphone-14-128gb-midnight-verizon/6505109?variant=A&skuId=6505109&sort=MOST_RECENT&page=2
04e612dee0c01557c6865c81e4cc3c3e,a890312fa336a7809cbfbb8f,Apple iPhone 14 128GB Midnight (Verizon) MPUA3LLA,2023-05-05,PatriciaD,Easy to use and screen is big and clear. I am happy that it is so similar to my previous phone that makes for easy transition.,5,True,https://www.bestbuy.com/site/reviews/apple-iphone-14-128gb-midnight-verizon/6505109?variant=A&skuId=6505109&sort=MOST_RECENT&page=2
04e612dee0c01557c6865c81e4cc3c3e,09c73701bd5435ac1056ff6f,Apple iPhone 14 128GB Midnight (Verizon) MPUA3LLA,2023-04-28,Sunshine2023,I love my iPhone. As a first time IPhone user I am pretty pleased. The Best Buy associates set it all up for me in store. They also answered all of my questions.,5,True,https://www.bestbuy.com/site/reviews/apple-iphone-14-128gb-midnight-verizon/6505109?variant=A&skuId=6505109&sort=MOST_RECENT&page=2
04e612dee0c01557c6865c81e4cc3c3e,13a63fdd85a476aae9ec2d63,Apple iPhone 14 128GB Midnight (Verizon) MPUA3LLA,2023-04-18,Honey,Liked the color but the otterbox covers most of the color,4,True,https://www.bestbuy.com/site/reviews/apple-iphone-14-128gb-midnight-verizon/6505109?variant=A&skuId=6505109&sort=MOST_RECENT&page=2
04e612dee0c01557c6865c81e4cc3c3e,d1ff33d08a9acddc19fa9b00,Apple iPhone 14 128GB Midnight (Verizon) MPUA3LLA,2023-04-15,Anonymous,My wife dropped her phone right AFTER the Apple protect plan expired.,5,True,https://www.bestbuy.com/site/reviews/apple-iphone-14-128gb-midnight-verizon/6505109?variant=A&skuId=6505109&sort=MOST_RECENT&page=3
04e612dee0c01557c6865c81e4cc3c3e,6ac53e879894a13d2dc99191,Apple iPhone 14 128GB Midnight (Verizon) MPUA3LLA,2023-04-14,LevanaP,Been a long time iPhone user. This is a awesome phone. Full size screen much faster & so many ways to customize!!! I love it!,5,True,https://www.bestbuy.com/site/reviews/apple-iphone-14-128gb-midnight-verizon/6505109?variant=A&skuId=6505109&sort=MOST_RECENT&page=3
04e612dee0c01557c6865c81e4cc3c3e,f925373ca97857ad97aa5192,Apple iPhone 14 128GB Midnight (Verizon) MPUA3LLA,2023-03-26,HelenW,The 14 is ok but not liking that apple changed everything so you have to buy new plug cannot use usb cords that I have plenty of. If I thought about it I would not go with this phone.,3,False,https://www.bestbuy.com/site/reviews/apple-iphone-14-128gb-midnight-verizon/6505109?variant=A&skuId=6505109&sort=MOST_RECENT&page=3
